{
  "id": "sf-no-fall-damage",
  "name": "SF No Fall Damage",
  "version": "1.1.1",
  "authors": ["bonsaibauer"],
  "dependencies": [],
  "description": "Applies the build-profile-verified native fall-damage patch.",
  "enabled": true,
  "settings": {},
  "shroudforge": {
    "schemaVersion": 1,
    "release": {"changelog": ["Fails activation when the native patch cannot be enabled and reports restoration failures."]},
    "settingsSchema": {"type": "object", "properties": {}, "additionalProperties": false},
    "settingGroups": [],
    "ui": {"sections": [{"title": "No Fall Damage", "description": "Build-specific runtime patch status.", "components": [{"type": "button", "label": "Toggle fall-damage patch", "action": "toggleFallDamagePatch", "style": "secondary"}]}]},
    "links": {"source-github": "https://github.com/bonsaibauer/shroudforge", "issues": "https://github.com/bonsaibauer/shroudforge/issues/new?template=bug_report.yml", "support-bmac": "https://buymeacoffee.com/bonsaibauer"}
  }
}
